{
  "id": "extract_003_ambiguous_multi_entity",
  "prompt": "extract_entities_lite",
  "description": "Ambiguous first-name reference when two Michaels exist; must emit the entity with person_name signal only and confidence 0.5, letting the resolver decide.",
  "template_vars": {
    "ArtifactKind": "chat",
    "ArtifactSHA": "1b7d24f8e0c5a109",
    "ArtifactPath": "wiki/artifacts/agent/1b7d24f8e0c5a109.md",
    "OccurredAt": "2026-04-18T09:30:00Z",
    "Body": "From: nazz@laf-office.local\nDate: 2026-04-18T09:30:00Z\n\nMichael said yesterday that the new eval harness should ship before the pilot. He wants a recall number by Friday.\n",
    "KnownEntities": [
      {
        "Slug": "michael-chen",
        "Kind": "person",
        "SignalsOneLine": "email=michael.chen@laf-office.local, person_name=Michael Chen",
        "Aliases": [],
        "AliasesJoined": ""
      },
      {
        "Slug": "michael-scott",
        "Kind": "person",
        "SignalsOneLine": "email=michael@dundermifflin.com, person_name=Michael Scott",
        "Aliases": [],
        "AliasesJoined": ""
      }
    ],
    "PredicateVocabulary": ["requested", "champions", "blocks"]
  },
  "expected": {
    "must_include": [
      "0.5",
      "person_name",
      "Michael"
    ],
    "must_not_include": [
      "michael-chen",
      "michael-scott",
      "michael.chen@laf-office.local",
      "michael@dundermifflin.com"
    ],
    "structured": {
      "entities": [
        {"kind": "person"}
      ],
      "confidence_max": 0.6,
      "signals_includes_person_name": true,
      "no_candidate_slug_chosen": true
    },
    "notes": "Guards Section 10.1 rule 7 + anti-pattern 5: when name is ambiguous and two known candidates exist, emit person_name only at confidence 0.5; do NOT pick a slug. Devil's-advocate M14 strengthening: confidence must be <= 0.6 to reflect ambiguity; neither candidate slug (michael-chen, michael-scott) may appear in the output; signals block must include person_name."
  }
}
